### ISSUE TITLE
Is there a way to build smcroute without having PIM enabled in kernel?

### ISSUE THREAD

**Issue by meteorza** [troglobit/smcroute#137]
Hi

I have successfully built and used smcroute many times in the past on arm64 boxes.

Trying to get the latest smcroute to work on a particular 64bit ARM box, but I have a problem getting the smcroute daemon to start.

From past experience, it is probably the 2 required PIM settings which is not enabled in the kernel.

```
CONFIG_IP_PIMSM_V1=y
CONFIG_IP_PIMSM_V2=y 
```

In the past, I just recompile the kernel with these PIM settings, and then it works fine.

The problem is that I can not get access to the kernel source for this arm64 box, so I am unable to recompile the kernel this time. 

The question is, could I build smcroute without the need for these PIM settings to be enabled?

I only need to be able to add/remove static routes and 

`cat /proc/net/dev_mcast `

shows all my interfaces are multicast-enabled so it seems the other required settings are enabled in the kernel.

If not possible, is there perhaps an older version of smcroute I could try where the PIM settings in the kernel were not a requirement?

Thank you.

**Comment by troglobit** [comment]
Unfortunately no.  Maybe v2.0.0 would work, but I doubt it.

**Comment by meteorza** [comment]
Thanks for the feedback, v2.0.0 was also unsuccessful.

I will try to bridge the ports for now.

**Comment by troglobit** [comment]
Yeah, I added support for `IGMP_NOCACHE` early to SMCRoute when I took over maintenance. Possibly we should have a build option to disable (*,G) support.

**Comment by meteorza** [comment]
That would be great as I have no luck getting the kernel source to enable PIM :-(     I need this specific kernel as most of the hardware drivers for the device are embedded in the kernel.

I am forwarding multicast traffic from a virtual dvb0_0 interface to eth0. If I now bridge the two interfaces as an alternative to using smcroute, I would get so much unnecessary multicast traffic on the LAN instead of just choosing what I need to forward with smcroute.

**Comment by troglobit** [comment]
OK, sounds reasonable.  What is the exact error message that SMCRoute gives (in terminal or syslog)?  I just want to rule out any other basic problems.

**Comment by meteorza** [comment]
Syslog shows:

```
Jan  1 05:29:40 linux daemon.notice smcroute[2208]: SMCRoute v2.4.4
Jan  1 05:29:40 linux daemon.err smcroute[2208]: Failed initializing IPv4 multicast routing API: Protocol not available
Jan  1 05:29:40 linux daemon.err smcroute[2208]: Failed initializing IPv6 multicast routing API: Protocol not available
Jan  1 05:29:40 linux daemon.err smcroute[2208]: Kernel does not support multicast routing.
```

cat /proc/net/dev_mcast

```
root@linux$ cat /proc/net/dev_mcast
6    dvb0_0          1     0     333300000001
6    dvb0_0          1     0     01005e000001
6    dvb0_0          1     0     3333000000fb
6    dvb0_0          1     0     01005e0000fb
2    eth0            1     0     333300000001
2    eth0            1     0     01005e000001
2    eth0            1     0     3333ff0f182c
2    eth0            1     0     3333000000fb
2    eth0            1     0     01005e0000fb
5    wlan0           1     0     333300000001
```
and
```
root@linux$ ifconfig
dvb0_0    Link encap:Ethernet  HWaddr 00:01:02:03:04:05
          inet addr:10.235.235.235  Bcast:10.255.255.255  Mask:255.255.255.255
          inet6 addr: fe80::201:2ff:fe03:405/64 Scope:Link
          UP BROADCAST RUNNING NOARP PROMISC ALLMULTI MULTICAST  MTU:4096  Metric:1
          RX packets:5233 errors:0 dropped:0 overruns:0 frame:0
          TX packets:0 errors:0 dropped:0 overruns:0 carrier:0
          collisions:0 txqueuelen:1000
          RX bytes:7043906 (6.7 MiB)  TX bytes:0 (0.0 B)
          Base address:0x7d5

eth0      Link encap:Ethernet  HWaddr D0:76:58:0F:18:2C
          inet addr:192.168.1.20  Bcast:192.168.1.255  Mask:255.255.255.0
          inet6 addr: fe80::d276:58ff:fe0f:182c/64 Scope:Link
          UP BROADCAST RUNNING MULTICAST  MTU:1500  Metric:1
          RX packets:16834 errors:0 dropped:0 overruns:0 frame:0
          TX packets:46847 errors:0 dropped:0 overruns:0 carrier:0
          collisions:0 txqueuelen:1000
          RX bytes:1530271 (1.4 MiB)  TX bytes:1579470 (1.5 MiB)
          Interrupt:40
```
I can see the multicast traffic on the dvb0_0 interface using tcpdump

_root@linux:/# tcpdump -i dvb0_0 -nnnn
tcpdump: verbose output suppressed, use -v or -vv for full protocol decode
listening on dvb0_0, link-type EN10MB (Ethernet), capture size 262144 bytes
05:38:33.187466 IP 192.168.135.20.43409 > 224.20.20.29.6002: UDP, length 1468
05:38:33.189170 IP 192.168.135.20.44860 > 224.20.20.29.6003: UDP, length 1468
05:38:33.191351 IP 192.168.135.20.51261 > 224.20.20.29.7000:  rx type 84 (1468)
05:38:33.193133 IP 192.168.135.20.44860 > 224.20.20.29.6003: UDP, length 1468
05:38:33.194814 IP 192.168.135.20.39099 > 224.20.20.29.6001: UDP, length 1468
05:38:33.196469 IP 192.168.135.20.43409 > 224.20.20.29.6002: UDP, length 1468
05:38:33.199255 IP 192.168.135.20.44860 > 224.20.20.29.6003: UDP, length 1468
05:38:33.203217 IP 192.168.135.20.44860 > 224.20.20.29.6003: UDP, length 1468_

**Comment by troglobit** [comment]
I see, that's what I feared :-(

Your kernel is not even built with `CONFIG_IP_MROUTE=y`.  That's the most basic requirement that any multicast routing application needs from the kernel.  The error messages say that both IPv4 and IPv6 multicast routing is unavailable. Specifically, the error message comes from when SMCRoute tries to do:

    setsockopt(mroute4_socket, IPPROTO_IP, MRT_INIT,  ...)

This operation has been with SMCRoute since its inception, and is shared also with dynamic routing daemons like mrouted (DVMRP) and pimd/pim6sd.

The fact that your interfaces have the MULTICAST flag has nothing to do with this, supporting multicast (filtering) on layer-2 is not the same as the multicast routing stack in layer-3.

I'm sorry, but I cannot help you in any way unfortunately.

**Comment by meteorza** [comment]
Ok, I understand, thank you.
